{
  "id": "u-005",
  "name": "Dr. Amara Okafor",
  "role": "postdoctoral researcher, computational social science",
  "organization": "University Research Lab",
  "level": "critical_thinker",
  "goals": [
    "Evaluate AI agents as research methodology tools",
    "Develop frameworks for responsible AI use in research",
    "Mentor junior researchers on AI literacy"
  ],
  "priorKnowledge": {
    "hasUsedChatbots": true,
    "hasUsedAgents": true,
    "toolsUsed": ["Claude", "ChatGPT", "Elicit", "Semantic Scholar API", "custom LangChain agents"],
    "selfRatedExperience": 9,
    "knownConcepts": ["prompt engineering", "RAG", "hallucination", "bias", "alignment", "RLHF", "evaluation metrics", "red-teaming", "epistemic uncertainty", "tool use"]
  },
  "dimensionScores": {
    "conceptualUnderstanding": 5.0,
    "promptingSkill": 4.5,
    "outputEvaluation": 5.0,
    "ethicalReasoning": 4.5,
    "criticalThinking": 5.0
  },
  "competencyScores": {
    "promptCrafting": 4.5,
    "outputEvaluation": 5.0,
    "appropriatenessJudgment": 4.5,
    "workflowDesign": 4.0
  },
  "courseEnrollment": {
    "courseId": "CSS-801-2026",
    "courseName": "Computational Social Science Seminar",
    "discipline": "social_science"
  },
  "learningPath": [
    { "moduleId": "m-601", "title": "Teaching Others AI Literacy", "status": "in_progress", "completedAt": null },
    { "moduleId": "m-602", "title": "Institutional AI Policy Design", "status": "not_started", "completedAt": null }
  ],
  "sessionCount": 22,
  "totalInteractions": 510,
  "createdAt": "2025-11-20T08:00:00Z",
  "lastActiveAt": "2026-04-01T17:00:00Z"
}
